<?xml version="1.0"?>
<xsd:schema
        xmlns:xsd="http://www.w3.org/2001/XMLSchema">

    <xsd:simpleType name="INTEGER">
        <xsd:restriction base="xsd:int">
            <xsd:maxInclusive value="2147483647"/>
            <xsd:minInclusive value="-2147483648"/>
        </xsd:restriction>
    </xsd:simpleType>

    <xsd:simpleType name="VARCHAR">
        <xsd:restriction base="xsd:string">
        </xsd:restriction>
    </xsd:simpleType>

    <xsd:complexType name="RowType.Miacd.public.car">
        <xsd:sequence>
            <xsd:element name="brand" type="VARCHAR" nillable="false"></xsd:element>
            <xsd:element name="model" type="VARCHAR" nillable="false"></xsd:element>
            <xsd:element name="production_year" type="INTEGER" nillable="false"></xsd:element>
            <xsd:element name="mileage" type="INTEGER" nillable="false"></xsd:element>
            <xsd:element name="vin_num" type="VARCHAR" nillable="false"></xsd:element>
        </xsd:sequence>
        <xsd:attribute name="id" type="INTEGER" use="required"/>
    </xsd:complexType>

    <xsd:complexType name="cars">
        <xsd:sequence minOccurs="1" maxOccurs="unbounded">
            <xsd:element name="car" type="RowType.Miacd.public.car"/>
        </xsd:sequence>
    </xsd:complexType>

    <xsd:element name="cars" type="cars"></xsd:element>
</xsd:schema>